"Status","Start Time","Stop Time","Duration in ms","Parent Suite","Suite","Sub Suite","Test Class","Test Method","Name","Description"
"passed","Tue Jan 09 15:01:55 IST 2024","Tue Jan 09 15:05:07 IST 2024","192374","Surefire suite","Surefire test","tests.parts.Spotorderparts","tests.parts.Spotorderparts","Test_007_verifyPO","Test_007 verify PO  ","Test Description: verify PO "
"failed","Tue Jan 09 15:08:19 IST 2024","Tue Jan 09 15:13:10 IST 2024","290418","Surefire suite","Surefire test","tests.parts.Spotorderparts","tests.parts.Spotorderparts","Test_009_verifyWarehouseText","Test_009 verify Warehouse Text ","Test Description: verify Warehouse Text () "
"passed","Tue Jan 09 15:05:07 IST 2024","Tue Jan 09 15:08:19 IST 2024","192041","Surefire suite","Surefire test","tests.parts.Spotorderparts","tests.parts.Spotorderparts","Test_008_verifyRequiredPart","Test_008 verify Required Part  ","Test Description: verify Required Part "
"passed","Tue Jan 09 14:56:22 IST 2024","Tue Jan 09 14:59:22 IST 2024","180010","Surefire suite","Surefire test","tests.parts.Spotorderparts","tests.parts.Spotorderparts","Test_005_verifySearchPartDescription","Test_005 verify Search Part Description ","Test Description:  verify Search Part Description  "
"passed","Tue Jan 09 14:52:42 IST 2024","Tue Jan 09 14:54:04 IST 2024","82005","Surefire suite","Surefire test","tests.parts.Spotorderparts","tests.parts.Spotorderparts","Test_002_clickOnSpotOrder","Test_002 click On The Spot order Tab ","Test Description:   click On The Spot order Tab  "
"passed","Tue Jan 09 14:54:04 IST 2024","Tue Jan 09 14:55:09 IST 2024","64785","Surefire suite","Surefire test","tests.parts.Spotorderparts","tests.parts.Spotorderparts","Test_003_inputPartialPartNumber","Test_003  input Partial Part Number ","Test Description:verify input Partial Part Number "
"passed","Tue Jan 09 14:59:22 IST 2024","Tue Jan 09 15:01:55 IST 2024","152260","Surefire suite","Surefire test","tests.parts.Spotorderparts","tests.parts.Spotorderparts","Test_006_inputCoreParentPart","Test_006 input Core Parent Part and sign out  ","Test Description: input Core Parent Part and sign out "
"passed","Tue Jan 09 14:52:11 IST 2024","Tue Jan 09 14:52:42 IST 2024","30432","Surefire suite","Surefire test","tests.parts.Spotorderparts","tests.parts.Spotorderparts","Test_001_gotoOrderPartsScreen","Test_001 Login to the page and go to Order Part screen ","Test Description:  Login to the page and go to Order Part screen  "
"passed","Tue Jan 09 14:55:09 IST 2024","Tue Jan 09 14:56:22 IST 2024","73297","Surefire suite","Surefire test","tests.parts.Spotorderparts","tests.parts.Spotorderparts","Test_004_clickOnAddButton","Test_004 click On Add Button ","Test Description:  click On Add Button "
